{"$id":"schemas/evidentrail/v1/approved_local_file_binding.schema.json","$schema":"https://json-schema.org/draft/2020-12/schema","additionalProperties":false,"properties":{"binding_digest":{"pattern":"^binding_sha256_[0-9a-f]{64}$","type":"string"},"contract":{"const":"evidentrail.approved_local_file_binding","type":"string"},"contract_version":{"const":1,"maximum":9007199254740991,"minimum":0,"type":"integer"},"material":{"additionalProperties":false,"properties":{"adapter":{"additionalProperties":false,"properties":{"kind":{"type":"string"},"version":{"type":"string"}},"required":["kind","version"],"type":"object"},"approved_locator":{"additionalProperties":false,"properties":{"locator":{"additionalProperties":false,"properties":{"relative_components":{"items":{"additionalProperties":false,"properties":{"byte_length":{"maximum":9007199254740991,"minimum":0,"type":"integer"},"data":{"pattern":"^[A-Za-z0-9_-]*$","type":"string"},"encoding":{"const":"base64url-nopad","type":"string"}},"required":["byte_length","data","encoding"],"type":"object"},"maxItems":4096,"type":"array"},"root":{"additionalProperties":false,"properties":{"byte_length":{"maximum":9007199254740991,"minimum":0,"type":"integer"},"data":{"pattern":"^[A-Za-z0-9_-]*$","type":"string"},"encoding":{"const":"base64url-nopad","type":"string"}},"required":["byte_length","data","encoding"],"type":"object"}},"required":["relative_components","root"],"type":"object"},"root_object_id":{"additionalProperties":false,"properties":{"device":{"type":"string"},"inode":{"type":"string"}},"required":["device","inode"],"type":"object"}},"required":["locator","root_object_id"],"type":"object"},"binding_id":{"pattern":"^bind_[0-9a-f]{64}$","type":"string"},"binding_version":{"maximum":9007199254740991,"minimum":0,"type":"integer"},"expires_at_unix_nanos":{"pattern":"^-?(0|[1-9][0-9]*)$","type":"string"},"internal_path_policy_digest":{"pattern":"^internal_path_policy_sha256_[0-9a-f]{64}$","type":"string"},"maximum_caps":{"additionalProperties":false,"properties":{"per_record_bytes":{"maximum":9007199254740991,"minimum":0,"type":"integer"},"records":{"maximum":9007199254740991,"minimum":0,"type":"integer"},"source_bytes":{"maximum":9007199254740991,"minimum":0,"type":"integer"},"wall_time_millis":{"maximum":9007199254740991,"minimum":0,"type":"integer"}},"required":["per_record_bytes","records","source_bytes","wall_time_millis"],"type":"object"},"ordering":{"type":"string"},"policy_digest":{"pattern":"^policy_sha256_[0-9a-f]{64}$","type":"string"},"policy_version":{"maximum":9007199254740991,"minimum":0,"type":"integer"},"repository_identity":{"pattern":"^repo_sha256_[0-9a-f]{64}$","type":"string"},"runtime_profile":{"additionalProperties":false,"properties":{"architecture":{"type":"string"},"certification_profile_digest":{"pattern":"^local_file_certification_profile_sha256_[0-9a-f]{64}$","type":"string"},"deadline_model":{"type":"string"},"filesystem":{"type":"string"},"operating_system":{"type":"string"}},"required":["architecture","certification_profile_digest","deadline_model","filesystem","operating_system"],"type":"object"},"snapshot_mode":{"type":"string"},"valid_from_unix_nanos":{"pattern":"^-?(0|[1-9][0-9]*)$","type":"string"}},"required":["adapter","approved_locator","binding_id","binding_version","expires_at_unix_nanos","internal_path_policy_digest","maximum_caps","ordering","policy_digest","policy_version","repository_identity","runtime_profile","snapshot_mode","valid_from_unix_nanos"],"type":"object"}},"required":["binding_digest","contract","contract_version","material"],"title":"evidentrail.approved_local_file_binding","type":"object"}