{"binding_digest":"binding_sha256_b6ec2c85f43706f0fb135e084bcf9f8a510e6e64c75656aa76fa3cbe82193d6c","contract":"evidentrail.approved_local_file_binding","contract_version":1,"material":{"adapter":{"kind":"local-file","version":"1.0.0"},"approved_locator":{"locator":{"relative_components":[{"byte_length":3,"data":"YXBw","encoding":"base64url-nopad"},{"byte_length":2,"data":"-_8=","encoding":"base64url-nopad"}],"root":{"byte_length":8,"data":"L3Zhci9sb2c","encoding":"base64url-nopad"}},"root_object_id":{"device":"18446744073709551615","inode":"9007199254740992"}},"binding_id":"bind_1111111111111111111111111111111111111111111111111111111111111111","binding_version":3,"expires_at_unix_nanos":"1700000060000000000","internal_path_policy_digest":"internal_path_policy_sha256_6666666666666666666666666666666666666666666666666666666666666666","maximum_caps":{"per_record_bytes":16384,"records":2000,"source_bytes":131072,"wall_time_millis":60000},"ordering":"single_file_byte_order_v1","policy_digest":"policy_sha256_4444444444444444444444444444444444444444444444444444444444444444","policy_version":7,"repository_identity":"repo_sha256_3333333333333333333333333333333333333333333333333333333333333333","runtime_profile":{"architecture":"aarch64","certification_profile_digest":"local_file_certification_profile_sha256_7777777777777777777777777777777777777777777777777777777777777777","deadline_model":"cooperative_deadline_between_io_calls_v1","filesystem":"apfs","operating_system":"macos"},"snapshot_mode":"whole_file_fixed_high_water_v1","valid_from_unix_nanos":"1699999999000000000"}}
